{
  "$schema": "https://json-schema.org/draft/2020-12/schema",
  "$id": "urn:kodex:schemas:codex-hook-ingress:v1:normalized-hook-envelope",
  "title": "codex-hook-ingress normalized hook envelope v1",
  "type": "object",
  "additionalProperties": false,
  "required": [
    "event_id",
    "schema_version",
    "hook_event_name",
    "event_time",
    "source_context",
    "run_context",
    "safe_payload",
    "payload_digest",
    "sanitizer_report",
    "downstream_routes",
    "correlation_id",
    "retention_class"
  ],
  "properties": {
    "event_id": {"$ref": "#/$defs/uuid"},
    "schema_version": {"const": "codex-hook-ingress.normalized-hook-envelope.v1"},
    "hook_event_name": {
      "type": "string",
      "enum": [
        "SessionStart",
        "UserPromptSubmit",
        "PreToolUse",
        "PermissionRequest",
        "PostToolUse",
        "Stop"
      ]
    },
    "event_time": {"$ref": "#/$defs/timestamp"},
    "source_context": {"$ref": "#/$defs/sourceContext"},
    "run_context": {"$ref": "#/$defs/runContext"},
    "tool_context": {"$ref": "#/$defs/toolContext"},
    "capability_context": {"$ref": "#/$defs/capabilityContext"},
    "safe_payload": {"$ref": "#/$defs/safePayload"},
    "payload_digest": {"$ref": "#/$defs/digest"},
    "sanitizer_report": {"$ref": "#/$defs/sanitizerReport"},
    "downstream_routes": {
      "type": "array",
      "minItems": 1,
      "maxItems": 8,
      "items": {"$ref": "#/$defs/downstreamRoute"}
    },
    "correlation_id": {
      "type": "string",
      "minLength": 1,
      "maxLength": 128,
      "pattern": "^[A-Za-z0-9_.:-]+$"
    },
    "retention_class": {
      "type": "string",
      "enum": ["audit", "operational", "realtime"]
    }
  },
  "allOf": [
    {
      "if": {
        "properties": {"hook_event_name": {"const": "SessionStart"}},
        "required": ["hook_event_name"]
      },
      "then": {
        "properties": {
          "safe_payload": {
            "type": "object",
            "required": ["start_source", "model", "workspace_ref"]
          }
        }
      }
    },
    {
      "if": {
        "properties": {"hook_event_name": {"const": "UserPromptSubmit"}},
        "required": ["hook_event_name"]
      },
      "then": {
        "properties": {
          "safe_payload": {
            "type": "object",
            "required": ["prompt_digest", "prompt_class", "safe_summary"]
          }
        }
      }
    },
    {
      "if": {
        "properties": {"hook_event_name": {"const": "PreToolUse"}},
        "required": ["hook_event_name"]
      },
      "then": {
        "required": ["tool_context"],
        "properties": {
          "tool_context": {
            "type": "object",
            "required": ["tool_name", "tool_category", "tool_use_id"]
          },
          "safe_payload": {
            "type": "object",
            "required": ["safe_summary", "risk_class"]
          }
        }
      }
    },
    {
      "if": {
        "properties": {"hook_event_name": {"const": "PermissionRequest"}},
        "required": ["hook_event_name"]
      },
      "then": {
        "required": ["tool_context"],
        "properties": {
          "tool_context": {
            "type": "object",
            "required": ["tool_name", "tool_category"]
          },
          "safe_payload": {
            "type": "object",
            "required": ["sanitized_reason", "risk_class", "permission_class", "timeout_budget_ms"]
          },
          "retention_class": {"const": "audit"}
        }
      }
    },
    {
      "if": {
        "properties": {"hook_event_name": {"const": "PostToolUse"}},
        "required": ["hook_event_name"]
      },
      "then": {
        "required": ["tool_context"],
        "properties": {
          "tool_context": {
            "type": "object",
            "required": ["tool_name", "tool_category", "tool_use_id"]
          },
          "safe_payload": {
            "type": "object",
            "required": ["exit_status", "output_digest"]
          }
        }
      }
    },
    {
      "if": {
        "properties": {"hook_event_name": {"const": "Stop"}},
        "required": ["hook_event_name"]
      },
      "then": {
        "properties": {
          "safe_payload": {
            "type": "object",
            "required": ["turn_status", "safe_summary"]
          }
        }
      }
    }
  ],
  "$defs": {
    "uuid": {
      "type": "string",
      "pattern": "^[0-9a-f]{8}-[0-9a-f]{4}-[1-5][0-9a-f]{3}-[89ab][0-9a-f]{3}-[0-9a-f]{12}$"
    },
    "timestamp": {
      "type": "string",
      "pattern": "^\\d{4}-\\d{2}-\\d{2}T\\d{2}:\\d{2}:\\d{2}(\\.\\d{1,9})?Z$"
    },
    "digest": {
      "type": "string",
      "pattern": "^sha256:[0-9a-f]{64}$"
    },
    "safeText": {
      "type": "string",
      "maxLength": 4096
    },
    "sourceContext": {
      "type": "object",
      "additionalProperties": false,
      "required": [
        "source_ref",
        "source_kind",
        "actor_ref",
        "organization_id",
        "project_id",
        "emitter_version",
        "trust_level"
      ],
      "properties": {
        "source_ref": {"type": "string", "minLength": 1, "maxLength": 128},
        "source_kind": {"type": "string", "enum": ["hook_emitter", "local_sidecar", "managed_hook"]},
        "actor_ref": {"type": "string", "minLength": 1, "maxLength": 128},
        "organization_id": {"$ref": "#/$defs/uuid"},
        "project_id": {"$ref": "#/$defs/uuid"},
        "repository_id": {
          "anyOf": [
            {"$ref": "#/$defs/uuid"},
            {"type": "null"}
          ]
        },
        "emitter_version": {"type": "string", "minLength": 1, "maxLength": 64},
        "trust_level": {"type": "string", "enum": ["managed", "trusted", "untrusted_rejected"]}
      }
    },
    "runContext": {
      "type": "object",
      "additionalProperties": false,
      "required": ["run_id", "session_id", "slot_id"],
      "properties": {
        "run_id": {"$ref": "#/$defs/uuid"},
        "session_id": {"type": "string", "minLength": 1, "maxLength": 128},
        "slot_id": {"$ref": "#/$defs/uuid"},
        "turn_id": {
          "anyOf": [
            {"type": "string", "minLength": 1, "maxLength": 128},
            {"type": "null"}
          ]
        },
        "role_ref": {
          "anyOf": [
            {"type": "string", "minLength": 1, "maxLength": 128},
            {"type": "null"}
          ]
        },
        "stage_ref": {
          "anyOf": [
            {"type": "string", "minLength": 1, "maxLength": 128},
            {"type": "null"}
          ]
        }
      }
    },
    "toolContext": {
      "type": "object",
      "additionalProperties": false,
      "properties": {
        "tool_name": {"type": "string", "minLength": 1, "maxLength": 128},
        "tool_category": {"type": "string", "enum": ["shell", "patch", "mcp", "other"]},
        "tool_use_id": {"type": "string", "minLength": 1, "maxLength": 128},
        "command_digest": {
          "anyOf": [
            {"$ref": "#/$defs/digest"},
            {"type": "null"}
          ]
        },
        "path_category": {
          "type": "string",
          "enum": ["workspace", "docs", "generated", "config", "secrets_area", "unknown"]
        },
        "mcp_tool_name": {
          "anyOf": [
            {"type": "string", "minLength": 1, "maxLength": 160},
            {"type": "null"}
          ]
        }
      }
    },
    "capabilityContext": {
      "type": "object",
      "additionalProperties": false,
      "required": ["capability_context_id", "selected_by_ref", "materialized_by_ref", "scope_kind", "skill_refs"],
      "properties": {
        "capability_context_id": {"$ref": "#/$defs/uuid"},
        "selected_by_ref": {"type": "string", "minLength": 1, "maxLength": 160},
        "materialized_by_ref": {"type": "string", "minLength": 1, "maxLength": 160},
        "scope_kind": {
          "type": "string",
          "enum": ["platform", "organization", "project", "repository", "flow", "stage", "role"]
        },
        "skill_refs": {
          "type": "array",
          "maxItems": 32,
          "items": {"$ref": "#/$defs/skillRef"}
        }
      }
    },
    "skillRef": {
      "type": "object",
      "additionalProperties": false,
      "required": ["source_kind", "skill_ref", "digest"],
      "properties": {
        "source_kind": {"type": "string", "enum": ["built_in", "repository", "package", "user"]},
        "skill_ref": {"type": "string", "minLength": 1, "maxLength": 160},
        "version_ref": {
          "anyOf": [
            {"type": "string", "minLength": 1, "maxLength": 128},
            {"type": "null"}
          ]
        },
        "package_installation_ref": {
          "anyOf": [
            {"type": "string", "minLength": 1, "maxLength": 160},
            {"type": "null"}
          ]
        },
        "digest": {"$ref": "#/$defs/digest"}
      }
    },
    "safePayload": {
      "type": "object",
      "additionalProperties": false,
      "properties": {
        "safe_summary": {"$ref": "#/$defs/safeText"},
        "start_source": {"type": "string", "enum": ["startup", "resume", "clear"]},
        "model": {"type": "string", "minLength": 1, "maxLength": 128},
        "permission_mode": {"type": "string", "enum": ["default", "acceptEdits", "plan", "dontAsk", "bypassPermissions"]},
        "workspace_ref": {"type": "string", "minLength": 1, "maxLength": 160},
        "prompt_digest": {"$ref": "#/$defs/digest"},
        "prompt_class": {"type": "string", "enum": ["user_instruction", "owner_feedback", "system_continuation", "unknown"]},
        "risk_class": {"type": "string", "enum": ["low", "medium", "high", "unknown"]},
        "sanitized_reason": {"$ref": "#/$defs/safeText"},
        "permission_class": {"type": "string", "enum": ["shell_escalation", "managed_network", "file_write", "provider_action", "unknown"]},
        "timeout_budget_ms": {"type": "integer", "minimum": 1, "maximum": 600000},
        "exit_status": {"type": "integer", "minimum": -1, "maximum": 255},
        "output_digest": {"$ref": "#/$defs/digest"},
        "bounded_error": {"$ref": "#/$defs/boundedError"},
        "provider_artifact_signal": {"$ref": "#/$defs/providerArtifactSignal"},
        "rate_limit_hint": {"$ref": "#/$defs/rateLimitHint"},
        "pending_action_refs": {
          "type": "array",
          "maxItems": 32,
          "items": {"type": "string", "minLength": 1, "maxLength": 160}
        },
        "checkpoint_ref": {
          "anyOf": [
            {"type": "string", "minLength": 1, "maxLength": 160},
            {"type": "null"}
          ]
        },
        "turn_status": {"type": "string", "enum": ["completed", "blocked", "failed", "waiting", "unknown"]}
      }
    },
    "boundedError": {
      "type": "object",
      "additionalProperties": false,
      "required": ["error_class", "safe_message", "truncated"],
      "properties": {
        "error_class": {"type": "string", "minLength": 1, "maxLength": 80},
        "safe_message": {"type": "string", "maxLength": 8192},
        "truncated": {"type": "boolean"},
        "error_digest": {
          "anyOf": [
            {"$ref": "#/$defs/digest"},
            {"type": "null"}
          ]
        }
      }
    },
    "providerArtifactSignal": {
      "type": "object",
      "additionalProperties": false,
      "required": ["provider_kind", "artifact_kind", "artifact_ref", "signal_kind"],
      "properties": {
        "provider_kind": {"type": "string", "enum": ["github", "gitlab", "unknown"]},
        "artifact_kind": {"type": "string", "enum": ["issue", "pull_request", "merge_request", "comment", "branch", "tag", "unknown"]},
        "artifact_ref": {"type": "string", "minLength": 1, "maxLength": 160},
        "signal_kind": {"type": "string", "enum": ["created", "updated", "mentioned", "rate_limit_hint", "unknown"]}
      }
    },
    "rateLimitHint": {
      "type": "object",
      "additionalProperties": false,
      "required": ["scope", "hint_class"],
      "properties": {
        "scope": {"type": "string", "minLength": 1, "maxLength": 128},
        "hint_class": {"type": "string", "enum": ["approaching_limit", "limited", "reset_observed", "unknown"]},
        "reset_ref": {
          "anyOf": [
            {"type": "string", "minLength": 1, "maxLength": 128},
            {"type": "null"}
          ]
        }
      }
    },
    "sanitizerReport": {
      "type": "object",
      "additionalProperties": false,
      "required": ["result", "applied_rules", "redaction_count", "truncated_fields", "rejected_field_classes"],
      "properties": {
        "result": {"type": "string", "enum": ["accepted", "redacted", "truncated"]},
        "applied_rules": {
          "type": "array",
          "minItems": 1,
          "maxItems": 64,
          "items": {"type": "string", "minLength": 1, "maxLength": 128}
        },
        "redaction_count": {"type": "integer", "minimum": 0, "maximum": 100000},
        "truncated_fields": {
          "type": "array",
          "maxItems": 32,
          "items": {"type": "string", "minLength": 1, "maxLength": 160}
        },
        "rejected_field_classes": {
          "type": "array",
          "maxItems": 32,
          "items": {"type": "string", "minLength": 1, "maxLength": 160}
        }
      }
    },
    "downstreamRoute": {
      "type": "object",
      "additionalProperties": false,
      "required": ["owner", "delivery_mode", "safe_parts"],
      "properties": {
        "owner": {
          "type": "string",
          "enum": [
            "agent-manager",
            "runtime-manager",
            "provider-hub",
            "governance-manager",
            "interaction-hub",
            "operations-feed",
            "audit-log"
          ]
        },
        "delivery_mode": {"type": "string", "enum": ["sync", "async", "realtime", "audit"]},
        "safe_parts": {
          "type": "array",
          "minItems": 1,
          "maxItems": 32,
          "items": {
            "type": "string",
            "enum": [
              "source_context",
              "run_context",
              "tool_context",
              "capability_context",
              "safe_summary",
              "prompt_digest",
              "risk_class",
              "sanitized_reason",
              "exit_status",
              "output_digest",
              "bounded_error",
              "provider_artifact_signal",
              "rate_limit_hint",
              "pending_action_refs",
              "checkpoint_ref",
              "sanitizer_report",
              "payload_digest",
              "correlation_id"
            ]
          }
        }
      }
    }
  }
}
