{
  "event_id": "11111111-4444-4111-8111-111111111111",
  "schema_version": "codex-hook-ingress.normalized-hook-envelope.v1",
  "hook_event_name": "PostToolUse",
  "event_time": "2026-05-22T15:03:00Z",
  "source_context": {
    "source_ref": "hook-emitter:slot-7",
    "source_kind": "hook_emitter",
    "actor_ref": "agent-manager:run-worker",
    "organization_id": "22222222-2222-4222-8222-222222222222",
    "project_id": "33333333-3333-4333-8333-333333333333",
    "repository_id": "44444444-4444-4444-8444-444444444444",
    "emitter_version": "0.1.0",
    "trust_level": "managed"
  },
  "run_context": {
    "run_id": "55555555-5555-4555-8555-555555555555",
    "session_id": "codex-session-7",
    "slot_id": "66666666-6666-4666-8666-666666666666",
    "turn_id": "turn-12",
    "role_ref": "role:developer",
    "stage_ref": "stage:implementation"
  },
  "tool_context": {
    "tool_name": "Bash",
    "tool_category": "shell",
    "tool_use_id": "toolu-003",
    "command_digest": "sha256:abababababababababababababababababababababababababababababababab",
    "path_category": "workspace",
    "mcp_tool_name": null
  },
  "safe_payload": {
    "permission_mode": "default",
    "safe_summary": "Command completed and produced a provider artifact signal.",
    "exit_status": 0,
    "output_digest": "sha256:bcbcbcbcbcbcbcbcbcbcbcbcbcbcbcbcbcbcbcbcbcbcbcbcbcbcbcbcbcbcbcbc",
    "provider_artifact_signal": {
      "provider_kind": "github",
      "artifact_kind": "pull_request",
      "artifact_ref": "provider-artifact:pull-request:example-1",
      "signal_kind": "updated"
    }
  },
  "payload_digest": "sha256:cdcdcdcdcdcdcdcdcdcdcdcdcdcdcdcdcdcdcdcdcdcdcdcdcdcdcdcdcdcdcdcd",
  "sanitizer_report": {
    "result": "redacted",
    "applied_rules": ["drop-tool-response", "hash-output", "provider-artifact-ref-only"],
    "redaction_count": 0,
    "truncated_fields": [],
    "rejected_field_classes": []
  },
  "downstream_routes": [
    {
      "owner": "agent-manager",
      "delivery_mode": "async",
      "safe_parts": ["source_context", "run_context", "tool_context", "capability_context", "safe_summary", "exit_status", "output_digest", "bounded_error", "provider_artifact_signal", "rate_limit_hint", "payload_digest", "correlation_id"]
    },
    {
      "owner": "provider-hub",
      "delivery_mode": "async",
      "safe_parts": ["run_context", "tool_context", "provider_artifact_signal", "payload_digest", "correlation_id"]
    },
    {
      "owner": "runtime-manager",
      "delivery_mode": "async",
      "safe_parts": ["run_context", "tool_context", "payload_digest", "correlation_id"]
    },
    {
      "owner": "operations-feed",
      "delivery_mode": "realtime",
      "safe_parts": ["run_context", "tool_context", "safe_summary", "provider_artifact_signal", "sanitizer_report", "correlation_id"]
    }
  ],
  "correlation_id": "run-5555:post-tool-use:toolu-003",
  "retention_class": "operational"
}
