{
  "event_id": "11111111-3333-4111-8111-111111111111",
  "schema_version": "codex-hook-ingress.normalized-hook-envelope.v1",
  "hook_event_name": "PermissionRequest",
  "event_time": "2026-05-22T15:02:00Z",
  "source_context": {
    "source_ref": "hook-emitter:slot-7",
    "source_kind": "hook_emitter",
    "actor_ref": "agent-manager:run-worker",
    "organization_id": "22222222-2222-4222-8222-222222222222",
    "project_id": "33333333-3333-4333-8333-333333333333",
    "repository_id": "44444444-4444-4444-8444-444444444444",
    "emitter_version": "0.1.0",
    "trust_level": "managed"
  },
  "run_context": {
    "run_id": "55555555-5555-4555-8555-555555555555",
    "session_id": "codex-session-7",
    "slot_id": "66666666-6666-4666-8666-666666666666",
    "turn_id": "turn-12",
    "role_ref": "role:developer",
    "stage_ref": "stage:implementation"
  },
  "tool_context": {
    "tool_name": "Bash",
    "tool_category": "shell",
    "tool_use_id": "toolu-002",
    "command_digest": "sha256:eeeeeeeeeeeeeeeeeeeeeeeeeeeeeeeeeeeeeeeeeeeeeeeeeeeeeeeeeeeeeeee",
    "path_category": "config",
    "mcp_tool_name": null
  },
  "safe_payload": {
    "permission_mode": "default",
    "sanitized_reason": "Command requests elevated shell access for a repository configuration check.",
    "risk_class": "medium",
    "permission_class": "shell_escalation",
    "timeout_budget_ms": 30000,
    "safe_summary": "Codex asks for permission before running a higher-risk shell action."
  },
  "payload_digest": "sha256:ffffffffffffffffffffffffffffffffffffffffffffffffffffffffffffffff",
  "sanitizer_report": {
    "result": "redacted",
    "applied_rules": ["drop-tool-input", "hash-command", "sanitize-reason"],
    "redaction_count": 1,
    "truncated_fields": [],
    "rejected_field_classes": []
  },
  "downstream_routes": [
    {
      "owner": "governance-manager",
      "delivery_mode": "sync",
      "safe_parts": ["source_context", "run_context", "tool_context", "risk_class", "sanitized_reason", "payload_digest", "correlation_id"]
    },
    {
      "owner": "agent-manager",
      "delivery_mode": "async",
      "safe_parts": ["run_context", "risk_class", "payload_digest", "correlation_id"]
    },
    {
      "owner": "interaction-hub",
      "delivery_mode": "async",
      "safe_parts": ["source_context", "run_context", "sanitized_reason", "risk_class", "correlation_id"]
    },
    {
      "owner": "audit-log",
      "delivery_mode": "audit",
      "safe_parts": ["source_context", "run_context", "tool_context", "risk_class", "sanitized_reason", "sanitizer_report", "payload_digest", "correlation_id"]
    }
  ],
  "correlation_id": "run-5555:permission-request:toolu-002",
  "retention_class": "audit"
}
